{
  "schemaVersion": 1,
  "datasetId": "paper-aisle-main-v1",
  "library": {
    "name": "Paper Aisle 论文库",
    "description": "围绕 Agent、强化学习与大语言模型整理的个人论文调研库，支持检索、筛选、收藏、对比与速读。",
    "updatedAt": "2026-10-25",
    "sources": [
      {
        "label": "arXiv 开放论文页面",
        "url": "https://arxiv.org/"
      },
      {
        "label": "ACL 官方论文页",
        "url": "https://aclanthology.org/"
      },
      {
        "label": "ICLR 官方论文页",
        "url": "https://proceedings.iclr.cc/"
      },
      {
        "label": "ICML 官方论文页",
        "url": "https://icml.cc/"
      },
      {
        "label": "NeurIPS 官方论文页",
        "url": "https://neurips.cc/"
      }
    ]
  },
  "config": {
    "directions": [
      "Agent",
      "RL",
      "LLM"
    ],
    "presentationTypes": [
      "Oral",
      "Spotlight",
      "Highlight",
      "Poster"
    ],
    "notableInstitutions": [
      {
        "name": "OpenAI",
        "type": "company",
        "aliases": []
      },
      {
        "name": "Google",
        "type": "company",
        "aliases": [
          "Google Brain",
          "Google Research",
          "Google DeepMind",
          "DeepMind",
          "Google AI Language"
        ]
      },
      {
        "name": "Meta",
        "type": "company",
        "aliases": [
          "Meta AI",
          "Meta AI Research",
          "Facebook AI Research",
          "FAIR"
        ]
      },
      {
        "name": "Microsoft",
        "type": "company",
        "aliases": [
          "Microsoft Research"
        ]
      },
      {
        "name": "NVIDIA",
        "type": "company",
        "aliases": [
          "NVIDIA Research"
        ]
      },
      {
        "name": "Anthropic",
        "type": "company",
        "aliases": []
      },
      {
        "name": "Apple",
        "type": "company",
        "aliases": [
          "Apple Machine Learning Research"
        ]
      },
      {
        "name": "Amazon",
        "type": "company",
        "aliases": [
          "Amazon Web Services",
          "AWS AI Labs"
        ]
      },
      {
        "name": "Alibaba",
        "type": "company",
        "aliases": [
          "Alibaba Group",
          "DAMO Academy"
        ]
      },
      {
        "name": "Tencent",
        "type": "company",
        "aliases": [
          "Tencent AI Lab"
        ]
      },
      {
        "name": "ByteDance",
        "type": "company",
        "aliases": [
          "ByteDance Research"
        ]
      },
      {
        "name": "Baidu",
        "type": "company",
        "aliases": [
          "Baidu Research"
        ]
      },
      {
        "name": "Stanford University",
        "type": "university",
        "aliases": [
          "Stanford"
        ]
      },
      {
        "name": "Massachusetts Institute of Technology",
        "type": "university",
        "aliases": [
          "MIT",
          "MIT CSAIL"
        ]
      },
      {
        "name": "Carnegie Mellon University",
        "type": "university",
        "aliases": [
          "CMU"
        ]
      },
      {
        "name": "UC Berkeley",
        "type": "university",
        "aliases": [
          "University of California, Berkeley"
        ]
      },
      {
        "name": "Tsinghua University",
        "type": "university",
        "aliases": [
          "Tsinghua"
        ]
      },
      {
        "name": "Peking University",
        "type": "university",
        "aliases": [
          "PKU"
        ]
      },
      {
        "name": "University of Toronto",
        "type": "university",
        "aliases": []
      },
      {
        "name": "ETH Zürich",
        "type": "university",
        "aliases": [
          "ETH Zurich"
        ]
      },
      {
        "name": "University of Oxford",
        "type": "university",
        "aliases": [
          "Oxford University"
        ]
      },
      {
        "name": "University of Cambridge",
        "type": "university",
        "aliases": [
          "Cambridge University"
        ]
      },
      {
        "name": "University of Illinois Urbana-Champaign",
        "type": "university",
        "aliases": [
          "University of Illinois at Urbana-Champaign",
          "UIUC"
        ]
      },
      {
        "name": "University of Washington",
        "type": "university",
        "aliases": []
      }
    ],
    "categoryColors": {
      "Agent": "oklch(84% 0.12 160)",
      "RL": "oklch(83% 0.14 25)",
      "LLM": "oklch(82% 0.12 230)"
    },
    "defaultCollectionId": "agent-stage01-batch-002"
  },
  "papers": [
    {
      "id": "arxiv-1706.03762",
      "title": "Attention Is All You Need",
      "authors": [
        {
          "name": "Ashish Vaswani",
          "affiliations": [
            "Google Brain"
          ]
        },
        {
          "name": "Noam Shazeer",
          "affiliations": [
            "Google Brain"
          ]
        },
        {
          "name": "Niki Parmar",
          "affiliations": [
            "Google Research"
          ]
        },
        {
          "name": "Jakob Uszkoreit",
          "affiliations": [
            "Google Research"
          ]
        },
        {
          "name": "Llion Jones",
          "affiliations": [
            "Google Research"
          ]
        },
        {
          "name": "Aidan N. Gomez",
          "affiliations": [
            "University of Toronto"
          ]
        },
        {
          "name": "Lukasz Kaiser",
          "affiliations": [
            "Google Brain"
          ]
        },
        {
          "name": "Illia Polosukhin",
          "affiliations": [
            "Google Research"
          ]
        }
      ],
      "venue": "NeurIPS",
      "year": 2017,
      "direction": "LLM",
      "subdirection": "序列建模",
      "contributionTypes": [
        "模型架构",
        "效率改进"
      ],
      "recommendationScore": 100,
      "quickRead": {
        "problem": "循环网络让长序列训练难以充分并行，远距离依赖也不易建模。",
        "finding": "仅使用注意力机制的模型在机器翻译上取得更高质量，同时显著提高训练并行度。",
        "approach": "用多头自注意力、位置编码和前馈网络组成编码器—解码器。"
      },
      "researchQuestion": "序列到序列建模是否可以完全放弃循环和卷积，只依赖注意力机制？",
      "method": "提出 Transformer，以缩放点积注意力和多头注意力构造编码器与解码器，并用位置编码保留词序。",
      "findings": "在 WMT 2014 英德和英法翻译任务上取得当时领先结果，训练成本低于此前主流架构。",
      "innovations": [
        "完全基于注意力的序列建模架构",
        "多头注意力",
        "可并行的全局依赖建模"
      ],
      "significance": "奠定了现代大语言模型及大量视觉、语音模型的基础架构。",
      "abstractExcerpt": "提出完全依赖注意力机制、无需循环和卷积的 Transformer 架构。",
      "links": {
        "official": "https://arxiv.org/abs/1706.03762",
        "pdf": "https://arxiv.org/pdf/1706.03762"
      }
    },
    {
      "id": "arxiv-1810.04805",
      "title": "BERT: Pre-training of Deep Bidirectional Transformers for Language Understanding",
      "authors": [
        {
          "name": "Jacob Devlin",
          "affiliations": [
            "Google AI Language"
          ]
        },
        {
          "name": "Ming-Wei Chang",
          "affiliations": [
            "Google AI Language"
          ]
        },
        {
          "name": "Kenton Lee",
          "affiliations": [
            "Google AI Language"
          ]
        },
        {
          "name": "Kristina Toutanova",
          "affiliations": [
            "Google AI Language"
          ]
        }
      ],
      "venue": "NAACL",
      "year": 2019,
      "direction": "LLM",
      "subdirection": "预训练语言模型",
      "contributionTypes": [
        "预训练方法",
        "模型架构"
      ],
      "recommendationScore": 97,
      "quickRead": {
        "problem": "早期语言模型通常只从单一方向读取上下文，难以形成真正的双向表示。",
        "finding": "双向预训练后只需轻量微调，就能在多类语言理解任务上获得强结果。",
        "approach": "通过掩码语言模型与下一句预测，在无标注文本上预训练双向 Transformer。"
      },
      "researchQuestion": "如何学习可被多种自然语言理解任务复用的深层双向表示？",
      "method": "随机遮盖输入词并预测原词，同时训练句间关系目标，再对下游任务进行端到端微调。",
      "findings": "在 GLUE、MultiNLI 与 SQuAD 等十一项任务上刷新当时的最佳结果。",
      "innovations": [
        "深层双向预训练",
        "统一的预训练—微调范式"
      ],
      "significance": "推动了通用预训练语言模型成为自然语言处理的标准工作流。",
      "abstractExcerpt": "BERT 通过同时利用左右上下文学习深层双向语言表示。",
      "links": {
        "official": "https://arxiv.org/abs/1810.04805",
        "pdf": "https://arxiv.org/pdf/1810.04805"
      }
    },
    {
      "id": "arxiv-1512.03385",
      "title": "Deep Residual Learning for Image Recognition",
      "authors": [
        {
          "name": "Kaiming He",
          "affiliations": [
            "Microsoft Research"
          ]
        },
        {
          "name": "Xiangyu Zhang",
          "affiliations": [
            "Microsoft Research"
          ]
        },
        {
          "name": "Shaoqing Ren",
          "affiliations": [
            "Microsoft Research"
          ]
        },
        {
          "name": "Jian Sun",
          "affiliations": [
            "Microsoft Research"
          ]
        }
      ],
      "venue": "CVPR",
      "year": 2016,
      "direction": "Agent",
      "subdirection": "图像识别",
      "presentationType": "Oral",
      "contributionTypes": [
        "模型架构",
        "优化方法"
      ],
      "recommendationScore": 96,
      "quickRead": {
        "problem": "网络越深越难优化，简单堆叠层数甚至会导致训练误差上升。",
        "finding": "残差连接让百层以上网络更容易训练，并显著提升图像识别表现。",
        "approach": "让网络学习相对输入的残差函数，并用恒等捷径跨层传递信息。"
      },
      "researchQuestion": "怎样让显著更深的神经网络仍然可以稳定优化并从深度中获益？",
      "method": "构造残差块，通过恒等快捷连接将输入直接加入堆叠层输出。",
      "findings": "152 层残差网络在 ImageNet 上取得领先结果，并迁移到检测与分割任务。",
      "innovations": [
        "残差学习框架",
        "恒等快捷连接"
      ],
      "significance": "残差连接成为深度学习架构中最广泛使用的基础构件之一。",
      "abstractExcerpt": "提出残差学习框架，以缓解显著加深网络带来的优化困难。",
      "links": {
        "official": "https://arxiv.org/abs/1512.03385",
        "pdf": "https://arxiv.org/pdf/1512.03385"
      }
    },
    {
      "id": "arxiv-2003.08934",
      "title": "NeRF: Representing Scenes as Neural Radiance Fields for View Synthesis",
      "authors": [
        {
          "name": "Ben Mildenhall",
          "affiliations": [